{
  "$schema": "./feature-matrix.schema.json",
  "matrix_schema_version": 1,
  "project_version": "0.3.0",
  "last_reviewed": "2026-09-04",
  "python_oracle": {
    "implementation": "UTide",
    "revision": "8fabe121752bc317931472a10a42e306715106de"
  },
  "contracts": {
    "rust_api": {
      "stability": "pre-1.0",
      "rust_version": "1.98"
    },
    "python_api": {
      "stability": "pre-1.0",
      "minimum_python": "3.9",
      "abi": "abi3-py39",
      "coefficient_schema": 1
    },
    "netcdf": {
      "scalar_schema_version": 18,
      "vector_schema_version": 17
    },
    "json_report": {
      "version_source": "matching-netcdf-schema"
    },
    "result_digest": {
      "stability": "schema-and-profile"
    }
  },
  "features": [
    {
      "id": "harmonic-ols",
      "title": "Scalar and vector ordinary least squares",
      "support": "supported",
      "scopes": ["core", "fvcom-scalar", "fvcom-vector"],
      "parity": "python-oracle",
      "evidence": ["crates/rutide-core/tests/python_oracle_fixed_raw.rs", "crates/rutide-core/tests/python_oracle_greenwich_nodal.rs"]
    },
    {
      "id": "mean-and-trend",
      "title": "Optional mean and linear trend",
      "support": "supported",
      "scopes": ["core", "fvcom-scalar", "fvcom-vector"],
      "parity": "python-oracle",
      "evidence": ["crates/rutide-core/tests/python_oracle_greenwich_nodal.rs"]
    },
    {
      "id": "constituent-catalog",
      "title": "Generated 146-constituent base and shallow-water catalog",
      "support": "supported",
      "scopes": ["core"],
      "parity": "python-oracle",
      "evidence": ["crates/rutide-core/src/catalog_generated.rs"]
    },
    {
      "id": "rayleigh-selection",
      "title": "Record-length-based Rayleigh constituent selection",
      "support": "supported",
      "scopes": ["core", "fvcom-scalar", "fvcom-vector"],
      "parity": "python-oracle",
      "evidence": ["crates/rutide-core/src/selection.rs"]
    },
    {
      "id": "phase-references",
      "title": "Greenwich, midpoint-linearized, and raw phase references",
      "support": "supported",
      "scopes": ["core", "fvcom-scalar", "fvcom-vector"],
      "parity": "python-oracle",
      "evidence": ["crates/rutide-core/tests/python_oracle_greenwich_nodal.rs"]
    },
    {
      "id": "nodal-corrections",
      "title": "Exact, midpoint-linearized, and disabled nodal corrections",
      "support": "supported",
      "scopes": ["core", "fvcom-scalar", "fvcom-vector"],
      "parity": "python-oracle",
      "evidence": ["crates/rutide-core/tests/python_oracle_greenwich_nodal.rs"]
    },
    {
      "id": "missing-observations",
      "title": "Per-series scalar and joint-component vector missing masks",
      "support": "supported",
      "scopes": ["core", "fvcom-scalar", "fvcom-vector"],
      "parity": "python-oracle",
      "evidence": ["crates/rutide-core/tests/python_oracle_greenwich_nodal.rs"]
    },
    {
      "id": "irregular-time",
      "title": "Irregular and gappy least-squares fits",
      "support": "supported",
      "scopes": ["core", "fvcom-scalar", "fvcom-vector"],
      "parity": "python-oracle",
      "evidence": ["crates/rutide-core/tests/python_oracle_greenwich_nodal.rs"]
    },
    {
      "id": "colored-confidence-fft",
      "title": "Regular and gappy-grid FFT colored confidence",
      "support": "supported",
      "scopes": ["core", "fvcom-scalar", "fvcom-vector"],
      "parity": "python-oracle",
      "evidence": ["crates/rutide-core/tests/python_oracle_greenwich_nodal.rs"]
    },
    {
      "id": "colored-confidence-lomb-scargle",
      "title": "Irregular-time Lomb-Scargle colored confidence",
      "support": "supported",
      "scopes": ["core", "fvcom-scalar", "fvcom-vector"],
      "parity": "python-oracle",
      "evidence": ["benchmarks/results/irregular-confidence-2026-09-01.md"]
    },
    {
      "id": "linear-confidence",
      "title": "Linearized scalar and vector confidence intervals",
      "support": "supported",
      "scopes": ["core", "fvcom-scalar", "fvcom-vector"],
      "parity": "python-oracle",
      "evidence": ["crates/rutide-core/tests/python_oracle_greenwich_nodal.rs"]
    },
    {
      "id": "monte-carlo-confidence",
      "title": "Seeded covariance-sampling confidence intervals",
      "support": "supported",
      "scopes": ["core", "fvcom-scalar", "fvcom-vector"],
      "parity": "rust-extension",
      "evidence": ["benchmarks/results/monte-carlo-confidence-2026-09-01.md"],
      "limitations": ["Python UTide does not expose a complete executable oracle for every Monte Carlo path"]
    },
    {
      "id": "robust-fitting",
      "title": "Configurable robust iteratively reweighted least squares",
      "support": "supported",
      "scopes": ["core", "fvcom-scalar", "fvcom-vector"],
      "parity": "python-oracle",
      "evidence": [
        "crates/rutide-core/tests/python_oracle_greenwich_nodal.rs",
        "crates/rutide-core/tests/python_oracle_inference.rs",
        "benchmarks/results/robust-fitting-2026-09-01.md"
      ],
      "limitations": [
        "Pinned Python UTide raises for Andrews, Huber, and logistic residual arrays; RUTide implements their standard definitions as tested extensions"
      ]
    },
    {
      "id": "scalar-inference",
      "title": "Exact and approximate scalar inferred constituents",
      "support": "supported",
      "scopes": ["core", "fvcom-scalar"],
      "parity": "python-oracle",
      "evidence": ["crates/rutide-core/tests/python_oracle_inference.rs"]
    },
    {
      "id": "vector-inference",
      "title": "Exact and approximate rotary vector inference",
      "support": "supported",
      "scopes": ["core", "fvcom-vector"],
      "parity": "python-oracle",
      "evidence": ["crates/rutide-core/tests/python_oracle_inference.rs"]
    },
    {
      "id": "inference-monte-carlo",
      "title": "Shared-reference Monte Carlo inference propagation",
      "support": "supported",
      "scopes": ["core", "fvcom-scalar", "fvcom-vector"],
      "parity": "rust-extension",
      "evidence": ["benchmarks/results/inferred-monte-carlo-2026-09-02.md"]
    },
    {
      "id": "diagnostic-ranking",
      "title": "Percent energy, SNR, and stable constituent presentation ranking",
      "support": "supported",
      "scopes": ["core", "fvcom-scalar", "fvcom-vector", "output"],
      "parity": "python-oracle",
      "evidence": ["crates/rutide-core/tests/python_oracle_greenwich_nodal.rs"]
    },
    {
      "id": "constituent-identifiability-diagnostics",
      "title": "Codiga RR, RNM, Corrmax, K/SNRallc, and tidal-variance diagnostics",
      "support": "supported",
      "scopes": ["core", "python-api", "fvcom-scalar", "fvcom-vector", "output"],
      "parity": "matlab-restoration",
      "evidence": ["DIAGNOSTICS.md", "crates/rutide-core/src/diagnostics.rs", "crates/rutide-core/tests/matlab_diagnostic_equations.rs", "benchmarks/results/constituent-diagnostics-2026-09-03.md", "crates/rutide-core/tests/python_oracle_inference.rs", "crates/rutide-cli/src/lib.rs", "crates/rutide-cli/src/vector.rs"]
    },
    {
      "id": "reconstruction",
      "title": "Filtered scalar and vector tidal reconstruction",
      "support": "supported",
      "scopes": ["core", "fvcom-scalar", "fvcom-vector", "output"],
      "parity": "python-oracle",
      "evidence": ["crates/rutide-core/tests/python_oracle_greenwich_nodal.rs"]
    },
    {
      "id": "cartesian-vector-reconstruction",
      "title": "Phase-wrap-safe Cartesian current coefficients and per-timestep queries",
      "support": "supported",
      "scopes": ["core", "python-api", "fvcom-vector", "output"],
      "parity": "rust-extension",
      "evidence": ["HARMONIC_CURRENT_ATLAS.md", "crates/rutide-core/src/vector.rs", "crates/rutide-core/src/corrected.rs", "crates/rutide-cli/src/vector.rs", "python/tests/test_api.py", "benchmarks/results/temporal-current-query-2026-09-03.md"]
    },
    {
      "id": "prefilter-transfer-correction",
      "title": "Known preprocessing-filter response correction",
      "support": "supported",
      "scopes": ["core", "python-api", "fvcom-scalar", "fvcom-vector", "output"],
      "parity": "matlab-restoration",
      "evidence": ["PREFILTER_TRANSFER.md", "crates/rutide-core/tests/matlab_prefilter_equations.rs", "python/tests/test_api.py", "crates/rutide-cli/src/lib.rs", "crates/rutide-cli/src/vector.rs"],
      "limitations": ["One real response is supported; complex or component-specific vector filters require a future coupled formulation", "Not needed for unfiltered source fields; near-zero or unknown filter response cannot be corrected safely"]
    },
    {
      "id": "spatial-current-atlas",
      "title": "Self-contained FVCOM mesh and harmonic-current query atlas",
      "support": "planned",
      "scopes": ["core", "python-api", "fvcom-vector", "output"],
      "parity": "rust-extension",
      "evidence": ["HARMONIC_CURRENT_ATLAS.md", "ROADMAP.md"],
      "limitations": ["Temporal current evaluation is complete; mesh lookup, interpolation, and OpenDrift integration remain planned"]
    },
    {
      "id": "time-epochs",
      "title": "Validated MJD, Python ordinal, Unix, and civil-time normalization",
      "support": "supported",
      "scopes": ["core", "fvcom-scalar", "fvcom-vector"],
      "parity": "python-oracle",
      "evidence": ["crates/rutide-core/src/time.rs"]
    },
    {
      "id": "solver-option-composition",
      "title": "Validated scalar and vector solver-option composition",
      "support": "supported",
      "scopes": ["core", "fvcom-scalar", "fvcom-vector", "output"],
      "parity": "python-oracle",
      "evidence": [
        "crates/rutide-cli/compatibility/solver-option-matrix-v1.json",
        "crates/rutide-core/tests/python_oracle_inference.rs",
        "crates/rutide-cli/src/lib.rs",
        "crates/rutide-cli/src/vector.rs"
      ],
      "limitations": [